{
  "schema_version": "v1",
  "agent_decision_id": "adec.synthetic.0001",
  "agent_invocation_id": "ainv.synthetic.0001",
  "decision_type": "emit_message",
  "produced_at": "2026-08-11T00:00:05Z",
  "emit_message": {
    "communication_purpose": "participant_turn_reply",
    "turn_id": "turn.synthetic.0001",
    "response_slot_id": "slot.synthetic.0001"
  }
}
